{
  "schema": "velours.library.acquisition-policy.v1",
  "default_max_bytes": 67108864,
  "user_agent": "VelourLibraryAcquisition/1.0",
  "sources": [
    {
      "id": "manufacturer-docs-example",
      "origin": "https://docs.example.com",
      "path_prefix": "/manuals",
      "source_label": "manufacturer",
      "trust_class": "primary",
      "allowed_content_types": [
        "application/pdf",
        "text/*"
      ],
      "allow_private_network": false,
      "rights_note": "Record the real publisher/license or usage basis before use.",
      "tags": [
        "approved-acquisition"
      ],
      "max_bytes": 33554432
    }
  ]
}
